{"$schema":"https://json-schema.org/draft/2020-12/schema","additionalProperties":false,"type":"object","properties":{"family":{},"version":{},"side_effects":{},"schemas":{},"diagnostics":{},"fixtures":{}},"required":["family","version","side_effects","schemas","diagnostics","fixtures"]}
