{"diagnostics":"diagnostics/diagnostics.json","family":"control-policy","fixtures":"fixtures/cases.json","schemas":{"binding_request":"schemas/binding-request.schema.json","binding_result":"schemas/binding-result.schema.json","contract":"schemas/contract.schema.json","decision":"schemas/decision.schema.json","diagnostic":"schemas/diagnostic.schema.json"},"side_effects":"forbidden","version":"1.0.0"}
